,ICO Name,ICO Symbol,ICO Description,Website,Twitter,Facebook,Instagram,Linkedin,Medium,STO Dates,Current Stage,STO Price,Softcap,Hardcap,Bonuses,Token Distribution,Whitepaper,Telegram,Youtube,Explorer,Bitcointalk,Github,Reddit,Message board,Email,,For Sale,Lightpaper,Onepager,Technical whitepaper,Discord,Slack,Blog,Registration document,Steem,Googleplus,Vimeo
TORUS Token ,TORUS Token ,(TRS) STO,"TORUS is a project founded by companies operating successfully in the field of wind energy sector for more than a decade. Our mission is to respond to the growing global demand for green energy sources. That is why we invest in renewable energy infrastructure worldwide and invite professional investors from selected jurisdictions to participate in a venture that has traditionally been reserved for enterprises that were able to cover large initial financial outlays, but above all had specialist knowledge and experience.",https://torus.net/?utm_source=coincodex&utm_medium=referral,https://twitter.com/Torus_Project,https://www.facebook.com/TORUSProjectOfficial,https://www.instagram.com/torus_project/,https://www.linkedin.com/company/torus-project,https://medium.com/@Torus_Project,"Jan 1, 2021 - Nov 30, 2021",STO,$ 1.00,$ 20.00M,$ 100.00M,Up to 10%,UNKOWN 87%/INVESTORS 13%,,,,,,,,,,,,,,,,,,,,,
MumbaToken ,MumbaToken ,(MBM) STO,"Become a new generation investor! Get the opportunity to buy/sell real estate from anywhere in a few minutes, because the liquidity of the property has increased hundreds of times. There is no need to manage objects, we take care of everything, and your dividends will be accrued automatically instant.",https://mumba.finance/?utm_source=coincodex&utm_medium=referral,https://twitter.com/Mumba_Platform,https://www.facebook.com/MubmaToken/,https://www.instagram.com/mumba_platform/,,,"May 1, 2021 - Dec 31, 2021",STO,$ 100.00,"$ 200,000","$ 400,000",n/a,UNKOWN 92.5%/INVESTORS 7.5%,https://docs.google.com/presentation/d/1dxyvx-ZQgLJ9OXyXrd9Ku3aOBV-ZRNXlXIvjQ9wYBaY/edit?usp=sharing&utm_source=coincodex&utm_medium=referral,https://t.me/mumba_channel,,,,,,,,,,,,,,,,,,,
Stobox Technologies Common Stock ,Stobox Technologies Common Stock ,(STBX) STO,"Stobox is an award-winning provider of asset tokenization services. We help to transfer ownership of your assets onto the blockchain to facilitate investment and trading. Stobox provides a full-cycle solution to raise capital via a security token offering. During the last three years, we conducted 15,000+ hours of research, advised multiple clients, built over 25 partnerships in 10+ countries, built 8 products and services, created hundreds of educational pieces about tokenization and decentralized finance.",https://dashboard.stobox.io/?utm_source=coincodex&utm_medium=referral,https://twitter.com/StoboxCompany,https://www.facebook.com/StoboxCompany,,https://www.linkedin.com/company/stobox/,https://stobox-platform.medium.com/,"Mar 1, 2021 - Mar 1, 2022",STO,$ 1.00,n/a,$ 1.00M,n/a,UNKOWN 90%/INVESTORS 10%,https://dashboard.stobox.io/?utm_source=coincodex&utm_medium=referral,https://t.me/stobox_official,https://www.youtube.com/channel/UCMKnSJ4dkf0V1QLx5Bo2QTw,https://etherscan.io/token/0x54f37F8c64AC1E3a451ff9762BFC8afe0eDb0f0A,,,,,,,,,,,,,,,,,
Blue Hill Foundation ,Blue Hill Foundation ,(BHF) STO,"The Blue Hill Mining security token is a real mining project that is a scalable, asset-backed security token directly linked to 30% ownership of the Blue Hill Mining project and supervised by one of the top-rated Swiss law firms.",https://bluehillfoundation.com/?utm_source=coincodex&utm_medium=referral,https://twitter.com/BH_Foundation1,https://www.facebook.com/bluehillfoundation/,,https://www.linkedin.com/company/bluehillfoundation,https://medium.com/blue-hill-foundation,"Apr 2, 2019 - n/a",STO,$ 0.14,n/a,n/a,,,https://www.bluehillfoundation.com/docs/whitepaper.pdf?utm_source=coincodex&utm_medium=referral,https://t.me/bluehillfoundation,,,https://bitcointalk.org/index.php?topic=5145356.new#new,https://github.com/BlueHillFoundation,https://www.reddit.com/user/bluehillfoundation,,,,,,,,,,,,,,
CROWDLITOKEN ,CROWDLITOKEN ,(CRT) STO,"CROWDLITOKEN represents the next generation of financial assets. It is a fully compliant digital bond which allows investors to participate in a European real estate portfolio. Investors can select their own properties, determine their individual risk-return-profile and choose freely between monthly cash pay-out or reinvestment of the cashflows. Investments are possible in CHF, EUR or Ether. The product has a maturity of 25 years, but it will be tradeable during the term. For the first time in financial history, it is possible to directly invest into an individually selected, tailor-made real estate portfolio that is at the same time tradeable.",https://crowdlitoken.com/?utm_source=coincodex&utm_medium=referral,,https://www.facebook.com/CROWDLITOKEN/,,https://www.linkedin.com/company/crowdlitoken/,,"Jul 8, 2019 - Nov 30, 2019",STO,$ 0.75,$ 45.00M,$ 200.00M,Up to 25%,UNKOWN 100%/INVESTORS 0%,,,https://www.youtube.com/channel/UCjQ7gytBdG1dC1QjrFKP-TQ?view_as=subscriber,https://etherscan.io/token/0x334a934fa07fce4fb7b1c89457fe9754c08f4d41?a=0x23f03fa916b4911c957c363865bc19dda8a7f741,,,,,,,,,,,,,,,,,
Gigajoule ,Gigajoule ,(GIGJ) STO,"Gigajoule Floating Solutions is an electricity generation company. It creates fully operational, gas-based power plants, floating on barges. It uses proven technologies together with Internet of Things (IoT) and blockchain technologies to ensure the highest standards of quality and efficiency.  This takes a fraction of the time required for traditional land-based plants, yet rivals or surpasses them in efficiency, reliability and cost.
 ",https://gigajoule.io/?utm_source=coincodex&utm_medium=referral,https://twitter.com/GigajouleT,https://www.facebook.com/gigajouletoken,,https://www.linkedin.com/company/gigajoule/?viewAsMember=true,https://medium.com/gigajoulet,"Nov 1, 2019 - n/a",STO,$ 1.00,$ 6.00M,$ 16.00M,,UNKOWN 80%/INVESTORS 10%,https://secureservercdn.net/160.153.137.210/d37.ba6.myftpupload.com/wp-content/uploads/2019/10/Gigajoule-Whitepaper.pdf?utm_source=coincodex&utm_medium=referral,https://t.me/Gigajoule_group,https://www.youtube.com/channel/UCyz7SfLezIXbmZdIQo4ozXw,,https://bitcointalk.org/index.php?topic=5182913.420,,https://www.reddit.com/user/Gigajoule_team,,,,,,,,,,,,,,
INX Token ,INX Token ,(INX) STO,"The INX Token is issued by INX Limited, a Gibraltar-based private company that was formed in 2017. The team is developing the so-called ""INX Tradin Solutions"" which is a single entry-point for their customers to trade cryptocurrencies, security tokens, and their derivatives.",https://token.inx.co/?utm_source=coincodex&utm_medium=referral,https://twitter.com/INXLimited,https://www.facebook.com/INXLtd/,,https://www.linkedin.com/company/inxlimited/,,"Aug 25, 2020 - n/a",STO,$ 0.90,n/a,$ 117.00M,,UNKOWN 65%/INVESTORS 17.5%,,https://t.me/inxltd,https://www.youtube.com/channel/UCgk9PJ_3NvCA-dIJ5PXNJeg,https://etherscan.io/address/0xbbc7f7a6aadac103769c66cbc69ab720f7f9eae3,,,https://www.reddit.com/r/INX_Ltd/,,,,,,,,,,,,,,
Blockchain Capital ,Blockchain Capital ,(BCAP) STO,"Blockchain Capital, founded in 2013, is one of the oldest and most active venture investors in the blockchain industry and has financed 75+ companies and projects since its inception. Their mission is to help entrepreneurs build world-class companies and projects based on blockchain technology. They invest in both equity and tokens and are a multi-stage investor. Blockchain Capital also pioneered the world's first ever tokenized investment fund and the blockchain industry's very first security token, the BCAP, in April of 2017.",http://blockchain.capital/?utm_source=coincodex&utm_medium=referral,https://twitter.com/blockchaincap,,,,,"Apr 10, 2017 - Apr 10, 2017",STO,$ 1.00,,,,UNKOWN 100%/INVESTORS 0%,,,,https://etherscan.io/token/BCAP,,,https://www.reddit.com/r/vctoken,https://bitcointalk.org/index.php?topic=1829499.0,mailto:mailto:contact@blockchaincapital.com,,0.00,,,,,,,,,,
Slice ,Slice ,(CRE) STO,"Slice is a commercial real estate platform that allows investment in US real estate to international investors. Private investors gain access to wealth building opportunities, while real estate owners and operators gain access to a large pool of untapped capital. Each asset token represents fully legal rights in the participating units of the asset. Users get both official certificate and tokens representing the investment which they could trade later.",https://slice.market/?utm_source=coincodex&utm_medium=referral,https://twitter.com/SliceCRE,,,https://www.linkedin.com/company/slice-re/,https://medium.com/@slice_re,To be announced...,STO,-,n/a,n/a,,UNKOWN 100%/INVESTORS 0%,,https://t.me/SliceRE,https://www.youtube.com/channel/UCM-LzjzApBToGRgeoeR81Aw,https://coincodex.enjinx.io/eth/token/0x61f33da40594cec1e3dc900faf99f861d01e2e7d,,,,,,,,,,,,,,,,,
Cryotech Nordic ,Cryotech Nordic ,(CTN) STO,"Cryotech Nordic is pioneering how it is possible for everyone to access cryotherapy chambers and localized cryotherapy. Its innovative and ground-breaking technology prevents the use of costly liquid nitrogen chambers, massively lowering expenses and opening up a once-niche sector to a much bigger and more affordable retail market.",https://www.cryotechnordic.com/?utm_source=coincodex&utm_medium=referral,http://www.twitter.com/cryotechnordic,http://www.facebook.com/cryotechnordic,http://www.instagram.com/cryotechnordic,https://www.linkedin.com/company/cryotechnordic,,To be announced...,STO,-,n/a,n/a,,UNKOWN 100%/INVESTORS 0%,,,https://www.youtube.com/channel/UCwalml3NO_ljK4J-nxtLItw,,,,,,,,,,,,,,,,,,
GIFcoin ,GIFcoin ,(GIF) STO,The GIF in GIFcoin stands for Gambling Investment Fund. This fund is backed by an already functioning betting website – VitalBet.com. The investors in the GIF Tokens will receive 80% of VitalBet's annual profits once a year.,https://goo.gl/WnvgvV?utm_source=coincodex&utm_medium=referral,https://twitter.com/gifcoin_io,https://www.facebook.com/gifcoin.io,,,https://medium.com/@gifcoin,"Mar 16, 2018 - Jun 12, 2018",STO,,,,,UNKOWN 88%/INVESTORS 12%,https://www.gifcoin.io/GifCoin-WhitePaper.pdf?utm_source=coincodex&utm_medium=referral,https://t.me/gifcoin,https://www.youtube.com/channel/UCLq13wzOH1STqW8I-Z-ctAQ,,https://bitcointalk.org/index.php?topic=2785607.0,https://gist.github.com/gifcointoken/6939120d88906efc3493e60eba1db592,https://www.reddit.com/r/GIFcointoken/,,,,263.00M,,,,,,,,,,
OpenFinance Network ,OpenFinance Network ,(OFN) STO,The OpenFinance Network aims to tokenize the financial world by building the first regulated trading platform for tokenized securities.,https://openfinance.io/?utm_source=coincodex&utm_medium=referral,https://twitter.com/openfinanceio,,,,https://medium.com/openfinance,To be announced...,STO,-,n/a,$ 50.00M,,UNKOWN 40%/INVESTORS 35%,https://www.openfinance.io/public/whitepaper.pdf?utm_source=coincodex&utm_medium=referral,,,,,https://github.com/openfinanceio,https://www.reddit.com/r/openfinance,,mailto:mailto:info@openfinance.io,,,https://openfinance.io/public/litepaper.pdf,,,,,,,,,
REI Capital Growth ,REI Capital Growth ,(REICG) STO,REI Capital Growth is a real estate investment fund that operates since 2013. The team behind REI has refined a distinct strategy that leverages over 90-years of combined hands-on experience and in-depth understanding of acquiring and managing multi-tenant shopping centers. The REI Capital company currently manages $30 million of assets.,https://www.reicapitalgrowth.com/?utm_source=coincodex&utm_medium=referral,https://twitter.com/ReiGrowth,https://www.facebook.com/REICapitalGrowth/?modal=admin_todo_tour,,https://www.linkedin.com/company/rei-capital-growth/?viewAsMember=true,https://medium.com/rei-capital-growth,To be announced...,STO,-,n/a,$ 100.00M,,UNKOWN 100%/INVESTORS 0%,https://www.reicapitalgrowth.com/wp-download/?utm_source=coincodex&utm_medium=referral,,https://www.youtube.com/channel/UCMgv48HJbAlTBZiuKHjSp3A,,,,,,,,,,,,,,,,,,
SD26 ,SD26 ,(SD26) STO,"Well known NBA athlete Spencer Dinwiddie hired a broker-dealer Tritaurian Capital for his upcoming token offering. Spencer Dinwiddie is the founder and sole member of the new SD26 project, which he recently rebranded from SD8 LLC to SD26LC. SD26 LC is still being formalized, and there is not a lot of information about the upcoming project.",,,,,,,To be announced...,STO,-,n/a,n/a,,UNKOWN 100%/INVESTORS 0%,,,,,,,,,,,,,,,,,,,,,
Stakeey ,Stakeey ,(TBC) STO,We think the world of art collectors and the people from whom it originates is much more connected than art galleries would have us imagine and we believe the decentralized web will play a massive role in magnifying the fundamental peer to peer transactions upon which the art gallery model is built.,https://stakeey.com/?utm_source=coincodex&utm_medium=referral,https://twitter.com/stakeey_,https://www.facebook.com/stakeey/,,,,To be announced...,STO,$ 0.10,"$ 300,000","$ 500,000",,UNKOWN 95%/INVESTORS 5%,,,,,,https://github.com/Stakeey,,,,,,,,,,,,,,,
MegaTech ,MegaTech ,(MGT) STO,"MegaTech is a sustainability project that builds, owns, operates and manages energy storage facilities. Their main goal is to make energy clean, sustainable, green and constantly available.",https://megatechmgt.com/?utm_source=coincodex&utm_medium=referral,,,,,,"Dec 17, 2020 - Mar 17, 2021",STO,,,,,UNKOWN 100%/INVESTORS 0%,https://megatechmgt.com/#/whitepaper?utm_source=coincodex&utm_medium=referral,,,,,,,,,,0.00,,https://megatechmgt.com/#/onepaper,https://megatechmgt.com/#/technicalpaper,,,,,,,
Bitvested Token ,Bitvested Token ,(BVD) STO,"Bitvested wants to make cryptocurrency investments profitable for everyone. By connecting experienced traders and (beginning) investors, we create a win-win situation for both parties. Experienced traders can generate more profit by trading collective funds. Investors can be profitable without spending any time or effort themselves.",https://bitvested.com/?utm_source=coincodex&utm_medium=referral,https://twitter.com/bitvested,,https://instagram.com/bitvested,,,"Dec 4, 2020 - Dec 4, 2020",STO,,,,,,https://bitvested.com/bitvested_whitepaper_nl_v2?utm_source=coincodex&utm_medium=referral,https://t.me/bitvested,,https://wavesdesk.com/asset/4fYY4WJDqQzFLNuuBn4Wf1pdzE4ZsNEwtCfhhmeyXqD3,,,,,,,10.00M,,,,,,,,,,
Classic Car Coin ,Classic Car Coin ,(CCC) STO,"The Classic Car Coin is a Netherlands based project with its own CCC token. The team behind it plans to build a portfolio of Classic Car. Mainly the token is used as a security token, where token holders are entitled to the profits generated by the company.",https://www.classiccarcoin.io/?utm_source=coincodex&utm_medium=referral,https://twitter.com/classic_coin,,,,,"Nov 1, 2020 - Nov 30, 2020",STO,,,,,UNKOWN 56%/INVESTORS 44%,https://www.classiccarcoin.io/wp-content/uploads/2020/08/CCC-Whitepaper-EN-1.2.pdf?utm_source=coincodex&utm_medium=referral,,,https://etherscan.io/token/0x27AF43a1c90F446f5079C1E8b443256E0AF2bb80,,,,,,,0.00,,,,,,,,,,
CERLOS ,CERLOS ,(CERLOS) STO,"CERLOS is an eco-friendly, sustainable, high-performance building material that is fire, mold, rot and insect resistant.",https://cerlos.io/?utm_source=coincodex&utm_medium=referral,https://twitter.com/Moxy_CERLOS/,https://www.facebook.com/Moxyoid/,https://www.instagram.com/moxycerlos/,https://linkedin.com/company/moxyoid/,https://medium.com/@moxy_cerlos/,"Dec 1, 2019 - Nov 30, 2020",STO,,,,,,https://cerlos.io/wp-content/uploads/2020/02/Cerlos_Whitepaper_v4small.pdf?utm_source=coincodex&utm_medium=referral,,https://www.youtube.com/channel/UC-aWkf565-blgwQOo8AnhzQ/,,,,,,,,0.00,,,,,,,,,,
Money Plant Token ,Money Plant Token ,(MPT) STO,Money Plant Token wants to serve the medical and healthcare industry by allowing users to pay for hospitalization or emergency care anywhere in the world with their token.,https://moneyplanttoken.io/?utm_source=coincodex&utm_medium=referral,https://twitter.com/MPTOKEN,https://facebook.com/mpt.token.9,https://www.instagram.com/mpt.token/,https://www.linkedin.com/in/moneyplanttoken,https://medium.com/@mpteth,"Aug 27, 2020 - Sep 28, 2020",STO,$ 0.00432,,,,UNKOWN 98%/INVESTORS 2%,https://moneyplanttoken.io/whitepaper.pdf?utm_source=coincodex&utm_medium=referral,https://t.me/joinchat/RwhyGRckEbN2AUszVHM2lA,https://youtu.be/DZJrOZkam-Q,https://etherscan.io/token/0x2cC1bE643e0882fB096f7f96d2b6Ca079ad5270c,,https://github.com/MoneyPlantTokaen,https://www.reddit.com/user/moneyplanttoken,,,,180.00M,,,,https://discord.gg/nZQaYQ2,https://moneyplanttokenmpt.slack.com/,,,,,
Light Coin Group Token ,Light Coin Group Token ,(LCG) STO,"Light Coin Group, formerly known as the Light Touch Research Institute, was founded in 2017 in Europe. After researching with certain achievements, the team has founded Light Coin Group to bring their technological breakthroughs and scientific achievements to commercial activities through specific projects.",https://lightcoinex.com/?utm_source=coincodex&utm_medium=referral,https://twitter.com/lightcoinex,https://facebook.com/lightcoinex,,,https://medium.com/@lightcoinex,"Jul 20, 2020 - Sep 20, 2020",STO,,,,,UNKOWN 75%/INVESTORS 25%,,unsafe:ttps://t.me/lightcoinex,,,,,https://www.reddit.com/user/Lightcoinex,,mailto:mailto:support@lightcoinex.com,,250.00M,,,,,,,,,,
Zetanet ,Zetanet ,(ZTN) STO,"Zetanet is a blockchain 5.0 project with an internet protocol that allows high speed, more secure and truly free network. It runs on a multi-layered and authentication-enhanced scheme for information encryption based on Jack’s Law application that focuses on encryption and autonomous storage. The scheme encrypts the whole or parts of the data according to its owners’ authorization by cryptography.",https://www.zetanet.io/?utm_source=coincodex&utm_medium=referral,,https://www.facebook.com/zetanetcorp/,,https://www.linkedin.com/company/skipjack-corporation/,,"Sep 1, 2019 - Sep 1, 2020",STO,,,,,UNKOWN 100%/INVESTORS 0%,https://www.zetanet.io/docs/Zetanet_Blockchain_5%20_WhitepaperVer_1.pdf?utm_source=coincodex&utm_medium=referral,,,,,,,,mailto:mailto:support@zetanet.io,,0.00,,,,,,https://blog.goodaudience.com/@sirmike3375,,,,
Sapien Equity Token ,Sapien Equity Token ,(SET) STO,"The Sapien app is a user-friendly, decentralized cryptocurrency lightwallet, which also collects post-transactional data from the users in the form of ratings and reviews. The data will be stored on a decentralized network to prevent bias or tampering, this way we can ensure that the data being stored is completely trustworthy.",https://sapienwallet.com/equity-sale/?utm_source=coincodex&utm_medium=referral,https://twitter.com/HumanRanking,https://www.facebook.com/SapienWallet,,https://www.linkedin.com/company/sapien-wallet,https://medium.com/@sapien.wallet,"Apr 27, 2020 - Jul 26, 2020",STO,,,,,,https://cryptototem.com/wp-ico/img/new%20projects/Sapien/Sapien_WP.pdf?utm_source=coincodex&utm_medium=referral,https://t.me/sapien_bounty,,,https://bitcointalk.org/index.php?topic=5230617,,,,,,1.00M,,,,,,,,,,
Enercom AG ,Enercom AG ,(ETH) STO,Enercom AG is a token based on the Ethereum Blockchain with the goal to create solutions for the telecommunications and renewable energy sector.,https://www.enercom.ag/?utm_source=coincodex&utm_medium=referral,https://twitter.com/enercom_ag,https://www.facebook.com/EnercomLiechtenstein,,https://www.linkedin.com/company/enercomag,,"Nov 25, 2019 - May 30, 2020",STO,,,,,UNKOWN 95%/INVESTORS 5%,https://www.enercom.ag/wp-content/uploads/2019/11/Prospectus_FINAL_Enercom-AG_signed.pdf?utm_source=coincodex&utm_medium=referral,https://t.me/enercom,https://www.youtube.com/channel/UCC1abu9vyM9d3WuKkqQLsLg,,,,,,,,"2,500.00",,,,,,,https://www.enercom.ag/wp-content/uploads/2019/11/Prospectus_FINAL_Enercom-AG_signed.pdf,,,
BESS Coin ,BESS Coin ,(BES) STO,BESS Kraftwerke™ + Blockchain - technology The disruptive high performance technology The world's first physically backed crypto currency that combines stability with sustainable growth Each Stable BESS-Coin is backed by every kilowatt of electricity genereated by the BESS Kraftwerke™ and their physical value,https://www.bess-coin-mining.com/?utm_source=coincodex&utm_medium=referral,https://twitter.com/@BESScoin,https://www.facebook.com/BESS-Coin-217399192147917/,https://www.instagram.com/BioEnergon_ltd/,https://www.linkedin.com/pulse/disruptive-high-performance-technology-bess-power-plants-peter-busca/,,"Feb 1, 2019 - Apr 1, 2020",STO,,,,,UNKOWN 100%/INVESTORS 0%,https://www.bess-coin-mining.com/files/whitepaper-en.pdf?utm_source=coincodex&utm_medium=referral,https://t.me/BESScoin,,https://etherscan.io/token/0x2ca0f61091e270d3903a20f4d63075abe01562c1,,,https://www.reddit.com/r/CryptoCurrency/comments/85jib9/bess_coin_ico_the_worlds_first_physically_backed/,,,,1.30B,,,,,,,,,,
Black One ,Black One ,(BOEG) STO,"Black One is the first fully integrated entertainment company in the Western World. Utilizing Korea’s proven superstar-building approach to realize the ultimate ecosystem for top talent in music and creative fields that develops raw talent into sustainable global mega-brands. All while crafting one exciting world of content, products and experiences.",https://blackone-entertainment.com/?utm_source=coincodex&utm_medium=referral,https://twitter.com/blackoneent,https://www.facebook.com/blackoneentertainment/,https://www.instagram.com/blackoneentertainment/,https://www.linkedin.com/company/black-one-entertainment-group/,,"Dec 5, 2019 - Mar 1, 2020",STO,,,,,,https://drive.google.com/file/d/1CcOeJWedyBTAuX3FURKQrYiFBXWj8cn1/view?usp=drive_open&utm_source=coincodex&utm_medium=referral,,,,,,,,,,0.00,,,,,,,,,,
TRADECLOUD ,TRADECLOUD ,(TCST) STO,"TradeCloud is a bespoke platform, designed and developed specifically for the physical commodity markets.",https://sto.tradecloud.sg/?utm_source=coincodex&utm_medium=referral,https://twitter.com/tradecloudsto,,,https://www.linkedin.com/company/tradecloud-services-pte-ltd,https://medium.com/tradecloud,"Jun 1, 2019 - Feb 29, 2020",STO,,,,,UNKOWN 50%/INVESTORS 47%,https://sto.tradecloud.sg/wp-content/themes/tradecloud/assets/file/TradeCloud_whitepaper%20executive%20summary_print.pdf?utm_source=coincodex&utm_medium=referral,https://t.me/TradeCloud_STO,,,,,,,,,0.00,,,,,,,,,,
DCI Ecosystem ,DCI Ecosystem ,(DCI) STO,"DCI Ecosystem is the First Cross Asset Ecosystem where classic asset classes are made available with tokenized asset classes in one place. This opens to investors limitless opportunities of investment returns before unthinkable. Institutions, Private investors, Business comes together in one ecosystem!",https://dciecosystem.com/?utm_source=coincodex&utm_medium=referral,https://twitter.com/dciecosystem,https://www.facebook.com/dciecosystem/,https://www.instagram.com/dciecosystem/,https://www.linkedin.com/company/dciecosystem/,,"Aug 5, 2019 - Feb 23, 2020",STO,,,,,UNKOWN 100%/INVESTORS 0%,,https://t.me/dciecosystem,https://www.youtube.com/channel/UC9C_Ry3SDD8FVX1Uv4_JrUA,,,,,,,,40.80M,,,,,,,,,,
Robinhood Casino ,Robinhood Casino ,(RHC) STO,"Robinhood is the world's first casino where anyone can be a card dealer from the comfort of their home. Robinhood removes casino operators, similar to how Uber removed taxi operators.",https://robinhood.casino/?utm_source=coincodex&utm_medium=referral,,,,,,"Nov 1, 2019 - Feb 20, 2020",STO,,,,,UNKOWN 50%/INVESTORS 50%,https://firebasestorage.googleapis.com/v0/b/robinhood-7ba00.appspot.com/o/whitepaper%2Frobinhood_1.2.17.pdf?alt=media&token=01f68403-c466-42de-b52e-60d8997506df&utm_source=coincodex&utm_medium=referral,https://t.me/robinhoodcasino,,https://etherscan.io/address/0x35761531e03fc278f907e8bea1b496a9ae3a8aa0,,,,,,,5.00M,,,,,,,,,,
DigiShares ,DigiShares ,(DIGI) STO,"DigiShares is among the first in Europe to provide a white-label software platform that can be used for investment funds, real estate funds, and later stage startups to raise funding by issuing shares as tokens on the blockchain and offering them for sale.",https://www.digishares.io/?utm_source=coincodex&utm_medium=referral,https://twitter.com/DigiSharesDK,https://www.facebook.com/gosecuriti,,https://www.linkedin.com/company/gosecurity/,,"Jul 2, 2019 - Feb 1, 2020",STO,,,,,UNKOWN 90%/INVESTORS 10%,,https://t.me/joinchat/IHDMSU9kIUAuG5bmHjbaIw,,,,,,,mailto:mailto:info@gosecurity.io,,"106,300",,,,,,,,,,
SolarStake ,SolarStake ,(SLRS) STO,"Solarstake is an asset-backed token where each token represents 1 watt of installed and revenue-generating solar power.  Net revenues from the operation are reinvested into building out new solar installations, at which point additional Solarstake tokens are minted and distributed to existing token holders proportional to their holdings, thus retaining the 1 token = 1-watt relationship.  ",https://www.solarstake.io/?utm_source=coincodex&utm_medium=referral,https://twitter.com/solar_stake,,,,,"Aug 1, 2019 - Jan 31, 2020",STO,,,,,UNKOWN 83%/INVESTORS 8.5%,https://solarstake.io/documents/SolarStake%20Whitepaper.pdf?utm_source=coincodex&utm_medium=referral,,,https://etherscan.io/address/0x58e909941a62e58eb17e96035c78edebd3516b1b,,,,,,,0.00,,,https://t.me/solarstake,,,,,,,
