,ICO Name,ICO Symbol,ICO Description,Website,Twitter,Facebook,Instagram,Linkedin,Medium,STO Dates,Current Stage,STO Price,Softcap,Hardcap,Bonuses,Token Distribution,Whitepaper,Telegram,Youtube,Explorer,Bitcointalk,Github,Reddit,Message board,Email,,For Sale,Lightpaper,Onepager,Technical whitepaper,Discord,Slack,Blog,Registration document,Steem,Googleplus,Vimeo
CRUZEO ,CRUZEO ,(CRZ) STO,The CRUZEO Protocol aims to empower the service economy by introducing a versatile toolbox for service providers and developers to build cheap and highly scalable decentralized marketplaces without prior programming experience.,https://cruzeo.io/?utm_source=coincodex&utm_medium=referral,https://twitter.com/Cruzeo_io,https://www.facebook.com/cruzeo.io/,,https://www.linkedin.com/company/cruzeo/,https://medium.com/cruzeo,"Apr 1, 2019 - Apr 30, 2019",STO,,,,,UNKOWN 50%/INVESTORS 50%,https://docsend.com/view/9pp5d3e?utm_source=coincodex&utm_medium=referral,https://t.me/cruzeo,,,,,https://www.reddit.com/r/cruzeo,,,,200.00M,,,,,,,,,,
edeXa ,edeXa ,(EDE) STO,"io-market founded the company edeXa AG, which will be one of the first companies worldwide to offer its thousands of existing customers the concrete processing of real transactions on the Blockchain. The Blockchain technology enables electronic invoices to be stored in a forgery-proof manner because manipulations of documents are immediately detected and prevented by dozens of decentralized servers. This high level of security without central intermediaries is one of the special advantages of modern blockchain technology.",https://edexa.io/?utm_source=coincodex&utm_medium=referral,https://twitter.com/edexablockchain,https://www.facebook.com/EDEXA-302612773660046/,,https://www.linkedin.com/company/edexablockchain/,,"Dec 18, 2018 - Apr 30, 2019",STO,,,,,UNKOWN 75%/INVESTORS 20%,https://edexa.io/WhitePaper_edeXa_V01.pdf?utm_source=coincodex&utm_medium=referral,https://t.me/edeXa,,,,,,,mailto:mailto:media@edexa.io,,15.00M,,,,,,,https://edexa.io/en/gtc/,,,
MilCoin ,MilCoin ,(MIL) STO,"The MilCoin Network is a visionary project aimed at becoming a global leader in real estate acquisition, development and operations of oceanfront resorts and entertainment. Its mission is to become a driver of tourism and community development, a model for sustainable land use and business practices and an innovator in technologies that shape the way investors conduct transactions. ",https://www.milcoin.io/?utm_source=coincodex&utm_medium=referral,https://twitter.com/@LtdLatam,https://www.facebook.com/Milcoin-943643289165155,https://www.instagram.com/latamoceanre/,,https://medium.com/@milcoinnetwork,"Jan 22, 2019 - Apr 30, 2019",STO,,,,,UNKOWN 100%/INVESTORS 0%,https://www.milcoin.io/whitepaper.pdf?utm_source=coincodex&utm_medium=referral,https://t.me/milcoinnetwork,https://www.youtube.com/channel/UCYEztLedyeU1-ZktYgWY0Fw,,,https://github.com/milcoinnetwork/milcoin,https://www.reddit.com/user/milcoin,,,,2.00M,,,,,,,,,,
Sonata.ai ,Sonata.ai ,(SONT) STO,Sonata is an exchange platform created in cooperation with experienced exchange brokers and Forex analytics. ,https://sonata.ai/?utm_source=coincodex&utm_medium=referral,https://twitter.com/Sonata_ai,https://www.facebook.com/sonata.cryptoexchange,,https://www.linkedin.com/company/sonata-ai/,https://medium.com/@sonata_exchange,"Oct 8, 2018 - Apr 30, 2019",STO,,,,,UNKOWN 50%/INVESTORS 25%,https://sonata.ai/documents/whitepaper-en.pdf?utm_source=coincodex&utm_medium=referral,https://t.me/joinchat/IwX6Zg-NhB3cJK1hPfbzVw,https://www.youtube.com/channel/UClGMr5_1zktOxmOdd9mUq5A,,,,https://www.reddit.com/user/Sonata-ai,,,,250.00M,,,,https://discord.gg/j9W9kef,,,,,,
Renovato ,Renovato ,(VATO) STO,Renovato is a blockchain-based advanced multi crypto exchange platform with innovative features for traders.,https://renovato.io/?utm_source=coincodex&utm_medium=referral,https://twitter.com/Renovato_STO,https://www.facebook.com/Renovato-Exchange-402589347182826,,,,"Feb 25, 2019 - Apr 30, 2019",STO,,,,,UNKOWN 100%/INVESTORS 0%,https://renovato.io/wp-content/uploads/2019/02/RENOVATOFX.pdf?utm_source=coincodex&utm_medium=referral,https://telegram.me/Renovato_Exchange,,,,,,,mailto:mailto:token@renovato.io,,0.00,,,,,,,,,,https://vimeo.com/user95090119
MOBU ,MOBU ,(MOBU) STO,MOBU is a decentralized organised ICO platform and end-to-end solution for launching compliant security tokens on the blockchain. ,https://www.mobu.io/?utm_source=coincodex&utm_medium=referral,https://twitter.com/MobuICO,https://web.facebook.com/MobuICO/,https://www.instagram.com/MobuICO/,,https://medium.com/mobu-io,"Sep 1, 2018 - Apr 30, 2019",STO,,,,,UNKOWN 80%/INVESTORS 12%,https://www.mobu.io/assets/mobu_whitepaper.pdf?80172489074&utm_source=coincodex&utm_medium=referral,https://t.me/mobuCHAT,https://www.youtube.com/watch?v=OEkbAX_hu_4,,https://bitcointalk.org/index.php?topic=3412875,,https://www.reddit.com/r/Mobu/,,,,280.00M,,,,,,,,,,
Bolton Coin ,Bolton Coin ,(BFCL) STO,"Bolton Coin offers a new and unique approach to investing in the crypto sphere, generating aggregates profits from tangible luxurious markets such as gold and diamonds mining, real estate, integrated by eco-sustainable energy and extraordinary form of BTC crypto-mining.",https://bfclcoin.com/?utm_source=coincodex&utm_medium=referral,https://twitter.com/BfclCoin,http://www.facebook.com/BFCLcoin,https://www.instagram.com/bfclcoin/,https://www.linkedin.com/company/bfcl-coin/,https://medium.com/@bfclcoin,"Aug 20, 2018 - Apr 15, 2019",STO,,,,,UNKOWN 54%/INVESTORS 33%,https://bfclcoin.com/pdf/bfclcoin_en.pdf?utm_source=coincodex&utm_medium=referral,https://t.me/joinchat/KLdFPRB1sKHrZ4G3Ax8Ucw,https://www.youtube.com/channel/UCvuB4ZrgOp5BgEVCpB1JqWg,,https://bitcointalk.org/index.php?topic=5083418.msg48603401#msg48603401,,https://www.reddit.com/user/BFCLCoin,,,,548.79M,https://bfclcoin.com/light-paper/,,,https://discord.gg/Xt6TyPy,,,,,,
Orbis ,Orbis ,(ORBS) STO,"ORBIS is a unique blockchain solution, with two coins available to users that allow them to withdraw, transfer, spend, and invest fiat money or cryptocurrencies with no fees, no wait times, and no middle man.",https://orbistransfer.com/?utm_source=coincodex&utm_medium=referral,https://twitter.com/OrbisToken,https://facebook.com/orbistoken,https://www.instagram.com/orbis_token/,,,"Nov 1, 2018 - Apr 15, 2019",STO,,,,,UNKOWN 70%/INVESTORS 30%,https://orbistransfer.com/#whitepaper?utm_source=coincodex&utm_medium=referral,https://t.me/orbisgroup,https://www.youtube.com/channel/UCRw-ywlW76rIXMY1p21U0AQ,https://coincodex.enjinx.io/eth/token/0xff56cc6b1e6ded347aa0b7676c85ab0b3d08b0fa,,https://github.com/1Orbis,https://www.reddit.com/user/OrbisTransfer,,,,80.00M,,,,,,,,,,
CURES ,CURES ,(CRS) STO,"CURES Token has been forged out of a desire to help address this problem, by decentralizing the health care system, empowering patients, health applications developers, medical service providers and equipment suppliers, embracing innovative technology in order to reduce costs and maximize scarce resources within the sector, creating near virtual competition, capitalizing on synergy which in turn adds value to all relevant stakeholders.",https://www.curestoken.com/?utm_source=coincodex&utm_medium=referral,https://twitter.com/CuresToken,https://www.facebook.com/curestoken,https://instagram.com/curestoken,https://www.linkedin.com/company/curestoken,,"Dec 1, 2018 - Mar 31, 2019",STO,,,,,UNKOWN 65%/INVESTORS 35%,https://s3.eu-central-1.amazonaws.com/curestoken/CuresToken+Whitepaper.pdf?utm_source=coincodex&utm_medium=referral,https://t.me/curestoken_community,,,https://bitcointalk.org/index.php?topic=5069816,,,,,,175.00M,,https://s3.eu-central-1.amazonaws.com/curestoken/CuresToken+Shortpaper.pdf,,,,,,,,
Secret Trees ,Secret Trees ,(STCT) STO,Secret Tree's objective is to create an ecosystem where the production of hemp and the materials and products it offers can benefit producers and consumers alike and provide a positive environmental impact.,https://secrettrees.io/?utm_source=coincodex&utm_medium=referral,https://twitter.com/secr3ttrees,https://www.facebook.com/secr3ttrees/,,,,"Nov 30, 2018 - Mar 31, 2019",STO,,,,,UNKOWN 100%/INVESTORS 0%,https://secrettrees.io/landing/assets/STHempPaper13.3.pdf?utm_source=coincodex&utm_medium=referral,https://t.me/joinchat/G93k-gsFXHcgoOgRhpicLw,https://www.youtube.com/channel/UCQBHZ2-yje4QDW7jnVDbx0Q,,,,,,,,0.00,,,,,,,,,,
Sovren Exchange ,Sovren Exchange ,(SVRN) STO,Sovren is a blockchain based investment platform created to bridge the gap between traditional online trading and tokenized securities investment.,https://sovren.app/?utm_source=coincodex&utm_medium=referral,https://twitter.com/SOVREN_STX,https://www.facebook.com/sovrenSTX,,https://www.linkedin.com/company/sovrensecurities,https://medium.com/@SovrenSTX,"Dec 7, 2018 - Mar 31, 2019",STO,,,,,UNKOWN 38%/INVESTORS 17%,https://drive.google.com/file/d/1Tg4Zc37U_ZarE83ZoYOglPWpCUVnpji5/view?utm_source=coincodex&utm_medium=referral,https://t.me/joinchat/HSoaZks3YowN9CfjisDAng,https://www.youtube.com/channel/UC3DEYrr8TuFmY3SeJA8p3Vg,,https://bitcointalk.org/index.php?topic=5063455.0,,https://www.reddit.com/r/SovrenSTX,,mailto:mailto:enquiry@sovren.app,,157.50M,,,,,,,,,,
GG World Lottery ,GG World Lottery ,(GGC) STO,"GG World Lottery is a fully licensed, government regulated global and national lottery with draw transparency based on the Ethereum Blockchain.",https://ico.gg.international/?utm_source=coincodex&utm_medium=referral,https://twitter.com/gg_int_ltd,https://www.facebook.com/gg.international.ltd,,https://www.linkedin.com/company/gginternational/,https://medium.com/@gg.international.ltd,"Jul 1, 2018 - Feb 28, 2019",STO,,,,,UNKOWN 75%/INVESTORS 25%,https://ico.gg.international/whitepaper?utm_source=coincodex&utm_medium=referral,https://t.me/gglottery,https://www.youtube.com/channel/UC6r282jPra2z5mA6A4r55wA,,https://bitcointalk.org/index.php?topic=5073793.0,,,,mailto:mailto:contact@gg.international,,375.00M,,,,,,,,,,
Infused Waters Coin ,Infused Waters Coin ,(IWCX) STO,Infused Waters project aims to launch a new kind of healthy and 100% natural Soft Drink Family. Infused Waters as a brand will disrupt the markets and provide a new awesome 100% natural taste! With the integration of the Blockchain technology in our business model.,http://www.infusedwaters.de/?utm_source=coincodex&utm_medium=referral,,,,,,"Dec 1, 2018 - Feb 28, 2019",STO,,,,,UNKOWN 100%/INVESTORS 0%,http://infusedwaters.de/WHITEPAPER_akt.pdf?utm_source=coincodex&utm_medium=referral,,,,,,,,mailto:mailto:support@infusedwaters.de,,9.00M,,http://infusedwaters.de/ONEPAGER.pdf,http://infusedwaters.de/Technical_hints.pdf,,,,,,,
Onasander ,Onasander ,(ONA) STO,Onasander is the first decentralized investment bank running on blockchain technology.,http://onasander.com/?utm_source=coincodex&utm_medium=referral,https://twitter.com/OnasanderICO,https://www.facebook.com/OnasanderICO,,,https://medium.com/@onasander,"Jul 22, 2018 - Feb 23, 2019",STO,,,,,UNKOWN 90%/INVESTORS 10%,,https://t.me/OnasanderICO,,,https://bitcointalk.org/index.php?topic=3948353.0,https://github.com/onasander,https://www.reddit.com/user/OnasanderICO/,,,,79.20M,,,,https://discord.gg/8tyyX8g,,,,,,
Sports Ledger ,Sports Ledger ,(SPSL) STO,"Sports Ledger is a revolutionary platform that will empower a wave of innovation in the world of sports, allowing users to access an innovative, data-driven platform that utilizes the latest advancements in Artificial Intelligence, Blockchain and Smart Contracts. The future of sports, providing access to a variety of services and rewarding users who contribute to the success of the ecosystem.",https://www.sportsledger.io/?utm_source=coincodex&utm_medium=referral,https://twitter.com/sportsledger_io,https://www.facebook.com/sportsledger,,,https://medium.com/@sportsledger,"Apr 1, 2018 - Feb 21, 2019",STO,,,,,UNKOWN 60%/INVESTORS 16%,https://www.sportsledger.io/doc/sports_ledger_whitepaper.pdf?utm_source=coincodex&utm_medium=referral,https://t.me/sportsledger,https://www.youtube.com/channel/UCMM8DjSoSUfiNcouisE8DxA,,https://bitcointalk.org/index.php?topic=3365766,https://github.com/cryptodus/SpslTokenSale,https://www.reddit.com/user/SportsLedger,,mailto:mailto:info@sportsledger.io,,588.00M,,,,,,,,,,
Cryptune ,Cryptune ,(CPTS) STO,Cryptune is a blockchain-based universal point of sale system that offers users and merchants a complete solution for when they are buying or selling goods or services with cryptocurrencies. ,https://www.cryptune.io/?utm_source=coincodex&utm_medium=referral,https://twitter.com/CryptunePOS,https://www.facebook.com/cryptune.io/,https://www.instagram.com/cryptunepos/,https://www.linkedin.com/in/cryptuneuniversalpos/,https://medium.com/@cryptune2018,"Nov 15, 2018 - Feb 11, 2019",STO,,,,,UNKOWN 52%/INVESTORS 15%,https://www.cryptune.io/CPT_WP.pdf?utm_source=coincodex&utm_medium=referral,https://t.me/cryptuneCPTS,https://www.youtube.com/channel/UCtXn4rkOGckcZm2d4INOjiA,,https://bitcointalk.org/index.php?topic=5067004.msg47773147,,,,,,5.20B,,,,,,,,,,
Dezos ,Dezos ,(DOS) STO,"Dezos is a decentralized & global security protocol, based on the blockchain technology, to fight against crime like theft, fraud & counterfeiting.",https://dezos.io/?utm_source=coincodex&utm_medium=referral,https://twitter.com/dezos_official,https://www.facebook.com/dezos.official,,https://www.linkedin.com/company/dezos,https://medium.com/@dezos.official,"Dec 11, 2018 - Jan 31, 2019",STO,,,,,UNKOWN 50%/INVESTORS 50%,,https://t.me/dezos_official,https://www.youtube.com/channel/UCig-nyUFGTVgVaqsk8rjX1Q,,https://bitcointalk.org/index.php?topic=5071912,https://github.com/dezos-ico,https://www.reddit.com/user/dezos_official,,,,450.00M,,,,,,,,,,
ORET ,ORET ,(ORET) STO,"ORET Token is one of the first options in the world of cryptocurrencies to invest and share the profits of a Gold Mining Company (Paraguay Mineral Mining S.A.) Thanks to the Blockchain technology, all ORET Token holders receive their weekly profits in Ethereum.",https://www.oretoken.io/?utm_source=coincodex&utm_medium=referral,https://twitter.com/oretoken,https://www.facebook.com/OREToken/?ref=your_pages,,https://www.linkedin.com/in/oret-token-134a63170/,https://medium.com/@OREToken,"Nov 1, 2018 - Jan 31, 2019",STO,,,,,UNKOWN 88%/INVESTORS 12%,https://www.oretoken.io/#whitepaper?utm_source=coincodex&utm_medium=referral,,https://www.youtube.com/channel/UC-k-C_syWLH4gH4D5TcKXMw,https://etherscan.io/token/0xf2c9989935339b416c53a1ba852ebf28cc0ffa64?a=0x0f3caa35751aefd4d614a6880279b4aa3d773e37,,,https://www.reddit.com/user/ORETtoken,,mailto:mailto:contact@oretoken.io,,11.00M,,https://www.oretoken.io/docs/ORET-Lightpaper.pdf,http://www.oretoken.io/docs/ORET-Whitepaper.pdf,https://discord.gg/SKZUbeF,https://join.slack.com/t/oretoken/shared_invite/enQtNDM3NTc0NTIwNDIyLWQ3YjJmNzA5MGQ3ZDM1MDYxOWEyOTg5YzZmYzEyYmEzNTZkYjE3ZjUwODc0YTg4ZDZkNWJhODRkOTc5YWIyNjM,,,,,
Impresso ,Impresso ,(XIM) STO,"Impresso Labs is a blockchain and mobile application based company. IMPRESSO the brand name is building digital trust by providing profile and CV data validation for the education, recruitment and networking industry.",https://www.impressolabs.io/?utm_source=coincodex&utm_medium=referral,https://twitter.com/ImpressoLabs,https://www.facebook.com/impressolabs/,https://www.instagram.com/impresso_labs/,https://www.linkedin.com/company/impresso/,https://medium.com/impressolabs,"Jan 4, 2019 - Jan 31, 2019",STO,,,,,UNKOWN 77%/INVESTORS 23%,,https://t.me/joinchat/Ef8m9RFv1_DIhtTIm9qEFA,,,https://bitcointalk.org/index.php?topic=5047386.new#new,https://github.com/benbeh/Impressolabs,https://www.reddit.com/r/Impresso/,,,,76.72M,,,,,,,,,,
SnowdenCoin ,SnowdenCoin ,(SNOW) STO,Snowden Coin is a blockchain based platform that aims to create a secure ecosystem where community members are able to carry out scalable transactions eliminating fees and downtime.,https://www.snowden-coin.com/?utm_source=coincodex&utm_medium=referral,https://twitter.com/ComSnowden,https://www.facebook.com/groups/SnowdenCoin/,,,https://medium.com/@guidociburski,"Sep 18, 2018 - Jan 22, 2019",STO,,,,,UNKOWN 67%/INVESTORS 23%,https://ultraupload.io/downloads/WP_EN.pdf?utm_source=coincodex&utm_medium=referral,https://t.me/snowdencoin,https://www.youtube.com/channel/UCDIMRjwDbDGN5wq7D3Ln5KA,,https://bitcointalk.org/index.php?topic=4982802,https://github.com/tcuag/snowden-coin,https://www.reddit.com/u/Snowden-Coin/?st=JMZ4WW4K&sh=aab93eab,,,,16.00M,,,,,https://join.slack.com/t/snowden-coin/shared_invite/enQtNDI0MTAyNTYzOTczLWQ3MWYzYTZkNmRjNTg0ZGUwZjYwYjcyZTU5MzQ0OWU4MGI3MGY2ZjE3MjkxNDc2NTcyZmU4OTExNGIzYWQ5YWY,,,,,
Mint Health ,Mint Health ,(MHST) STO,"Mint Health is aiming to build a decentralized health platform that empowers patients with a self-sovereign health identity and aligns patients, providers, and payers to battle chronic disease.",https://www.minthealth.io/?utm_source=coincodex&utm_medium=referral,https://twitter.com/mint_health,https://www.facebook.com/MintHealth1/,,https://www.linkedin.com/company/18304722/,https://medium.com/@Mint_Health,"Sep 30, 2018 - Dec 31, 2018",STO,,,,,UNKOWN 100%/INVESTORS 0%,https://www.minthealth.io/wp-content/uploads/2018/04/MH_WHITEPAPER_04.18.pdf?utm_source=coincodex&utm_medium=referral,https://t.me/joinchat/G5Vv_gu5hL332ptnK6qJzA,,,,,,,,,90.00M,,,,,,,https://www.sec.gov/Archives/edgar/data/1725804/000106299318001496/xslFormDX01/primary_doc.xml,,,
Goldma ,Goldma ,(GMA) STO,"Goldma is a gold-backed cryptocurrency, where the GMA tokens represent the gold mining asset in Africa. ",https://goldma.io/?utm_source=coincodex&utm_medium=referral,https://twitter.com/GoldMA_Coin,https://www.facebook.com/GoldMAZimbabwe/,https://www.instagram.com/goldma_zw/,https://www.linkedin.com/company/11560473/,https://medium.com/@goldma,"Jun 7, 2018 - Oct 12, 2018",STO,,,,,UNKOWN 51%/INVESTORS 25.5%,https://goldma.io/assets/files/GoldmaWhitePaperV10.pdf?utm_source=coincodex&utm_medium=referral,https://t.me/joinchat/He_y1hHwCYJ0Rr01xXJZEQ,https://www.youtube.com/channel/UCNcGmhIBRmDUn2B4tn2-_ZA,,,,https://www.reddit.com/r/Gold_MA/,,mailto:mailto:info@goldma.io,,730.30M,,,,,,,,,,
INGOT Coin ,INGOT Coin ,(IC) STO,"INGOT Coin is the first fully integrated Wallet with a Digital Bank, Brokerage, Exchange, Certifier, and ICO Accelerator. All components are rolled into a single and complete ecosystem, which rewards token holders and consumers for using and contributing to it. INGOT Coin is a decentralized cryptocurrency, which provides benefits and discounts within the ecosystem itself.",https://www.ingotcoin.io/?utm_source=coincodex&utm_medium=referral,https://twitter.com/ICOINGOT,https://www.facebook.com/ICOINGOT/,https://www.instagram.com/icoingot/,https://www.linkedin.com/company/ingotcoin/,,"May 1, 2018 - Oct 10, 2018",STO,,,,,UNKOWN 75%/INVESTORS 25%,https://www.ingotcoin.io/documents/en/white-paper.pdf?utm_source=coincodex&utm_medium=referral,https://t.me/INGOTCoin,https://www.youtube.com/channel/UCkhXGyI_piMMDMtyrYjI_IA,,https://bitcointalk.org/index.php?topic=3581009.new,,,,,,120.00M,,,,,,,,,,
Neluns ,Neluns ,(NLS) STO,"Neluns is an innovative financial ecosystem that contains within itself a bank, a cryptocurrency exchange and an insurance company that operates with fiat and cryptocurrencies.",https://neluns.io/?utm_source=coincodex&utm_medium=referral,https://twitter.com/theneluns,https://www.facebook.com/The-Neluns-2038488129802279,,,https://medium.com/@iconeluns,"Aug 1, 2018 - Oct 5, 2018",STO,$ 1.00,,,,UNKOWN 80%/INVESTORS 12%,https://neluns.io/static/ver165/whitepaper/whitepaper.pdf?utm_source=coincodex&utm_medium=referral,http://t.me/TheNelunsChat,https://www.youtube.com/channel/UCap59w27OBC_Cn9nsQxthTA,,https://bitcointalk.org/index.php?topic=4694028,,https://www.reddit.com/r/NelunsProject/?st=JK201PMO&sh=8e3addc0,,,,200.00M,,,,,,,,,,https://vimeo.com/neluns
Alehub ,Alehub ,(ALE) STO,Alehub wants to create a platform for project management and for contractors search in IT and Hi-Tech areas.,https://alehub.io/?utm_source=coincodex&utm_medium=referral,https://twitter.com/alehub_io,https://www.facebook.com/alehub.io/,https://www.instagram.com/alehub.io/,,,"Jul 25, 2018 - Sep 24, 2018",STO,$ 0.30,,,,UNKOWN 77%/INVESTORS 11%,https://alehub.io/ALEHUB_WP_eng.pdf?utm_source=coincodex&utm_medium=referral,https://t.me/alehub,https://www.youtube.com/channel/UCQmFu8R6TIKU1Vz10HrvFYg,,https://bitcointalk.org/index.php?topic=3676768.new,https://github.com/effective-energy,,,mailto:mailto:invest@alehub.io,,162.47M,,https://alehub.io/ALEHUB_OP_eng.pdf,,,,,,,,
Augmate ,Augmate ,(MATE) STO,Augmate is the world's first IoT Device Management platform that was developed with the purpose to serve the needs of workers that use wearable glasses. The main goal was to develop a management platform for the IT users to centrally control all of the new devices coiming onto their system. ,https://www.augmate.io/?utm_source=coincodex&utm_medium=referral,https://twitter.com/augmate,https://www.facebook.com/augmate,,https://www.linkedin.com/company/augmate,https://medium.com/@augmate,"Jan 1, 2018 - Jun 30, 2018",STO,,,,,UNKOWN 35%/INVESTORS 30%,https://d1mgxjk1p6bgsz.cloudfront.net/wp-content/uploads/2018/04/AC_Whitepaper-1.pdf?utm_source=coincodex&utm_medium=referral,https://t.me/AugmateOfficial,,,,,https://www.reddit.com/r/Augmate/,,,,15.00B,,,,,,,https://www.sec.gov/Archives/edgar/data/1614614/000161461417000003/xslFormDX01/primary_doc.xml,,,
Witnet Foundation ,Witnet Foundation ,(WIT) STO,Witnet Foundation is building a decentralized oracle network that aims to connect smart contracts to any available online source data.,https://witnet.io/#/?utm_source=coincodex&utm_medium=referral,https://twitter.com/witnet_io,,,,https://medium.com/witnet,"Mar 1, 2018 - Apr 30, 2018",STO,,,,,UNKOWN 100%/INVESTORS 0%,https://witnet.io/static/witnet-whitepaper.pdf?utm_source=coincodex&utm_medium=referral,https://t.me/witnetio,,,,https://github.com/witnet,https://reddit.com/r/witnet,,mailto:mailto:info@witnet.foundation,,0.00,,,,https://discord.gg/X4uurfP,,,https://www.sec.gov/Archives/edgar/data/1730100/000173010018000003/xslFormDX01/primary_doc.xml,,,
22x Fund ,22x Fund ,(22X) STO,"The 22X Fund is the brainchild of startup founders from Batch 22 of 500 Startups Accelerator program. Like most great ideas, what started as spitballing over beers snowballed into a batch-wide effort that sought to create a tokenized investment offering. The startups are represented by one token that seeks to give investors more liquidity and better returns.",https://22xfund.com/?utm_source=coincodex&utm_medium=referral,https://twitter.com/22xfund,,,,https://medium.com/22xfund,"Jan 26, 2018 - Mar 23, 2018",STO,$ 1.00,,,,UNKOWN 100%/INVESTORS 0%,https://docsend.com/view/x65nwx6?utm_source=coincodex&utm_medium=referral,https://t.me/community22X,https://www.youtube.com/channel/UC8Oa9_EAoRo51n3z2iCfY0g,,,,,,mailto:mailto:hello@22xfund.com,,0.00,,,,,,,,,,
Crowd For Angels ,Crowd For Angels ,(ANGEL) STO,"Crowd for Angels is a leading UK crowdfunding platform that raises funds for companies through the issue of shares, crowd bonds and tokens to investors.",https://crowdforangels.com/?utm_source=coincodex&utm_medium=referral,https://twitter.com/crowdforangels,https://www.facebook.com/CrowdforAngels,,,https://medium.com/@crowdforangels,"Feb 1, 2018 - Feb 14, 2018",STO,,,,,UNKOWN 100%/INVESTORS 0%,,https://t.me/CrowdforAngels,,,https://bitcointalk.org/index.php?topic=2490127.0,,,,,,5.00B,,,,,,,,,,
