,ICO Name,ICO Symbol,ICO Description,Website,Twitter,Facebook,Instagram,Linkedin,Medium,STO Dates,Current Stage,STO Price,Softcap,Hardcap,Bonuses,Token Distribution,Whitepaper,Telegram,Youtube,Explorer,Bitcointalk,Github,Reddit,Message board,Email,,For Sale,Lightpaper,Onepager,Technical whitepaper,Discord,Slack,Blog,Registration document,Steem,Googleplus,Vimeo
DIC Token ,DIC Token ,(DIC) STO,"DIC token is a digital asset backed by DIC Resorts and Apartments being developed by DIC EAST DMCC FZE on Al Marjan Island. DIC Trading Ltd (HK), holding parent company of DIC EAST DMCC (the asset holder of the DIC Resorts development) is issuing the DIC Unit Tokens to accredited investors. Unit tokens are an asset-backed IOUs and they are a legally binding investment contract between the issuer and investors that entitles every Token holder a yearly remuneration plus a redemption premium at term.",https://www.dicresortoken.io/?utm_source=coincodex&utm_medium=referral,,,,,,"Apr 18, 2019 - Dec 31, 2019",STO,,,,,UNKOWN 83%/INVESTORS 10%,https://www.dicresortoken.io/theme-assets/images/whitepaper.pdf?utm_source=coincodex&utm_medium=referral,,,https://etherscan.io/address/0x263679bCbFd9b051629C1a56472Ba9377E9175b4,,,,,,,29.05M,,https://www.dicresortoken.io/theme-assets/images/one-page-teaser.pdf,,,,,,,,
Look Lateral ,Look Lateral ,(LOOK) STO,"Look Lateral’s vision is to enable global, open access to the art market via a blockchain-based technology platform allowing secure participation in art both as an asset class and a cultural asset.",https://www.looklateral.com/?utm_source=coincodex&utm_medium=referral,https://twitter.com/LookLateral,https://www.facebook.com/Look-Lateral-35717707466/,,https://www.linkedin.com/company/look-lateral/,https://medium.com/@looklateral,"Jan 8, 2019 - Dec 31, 2019",STO,,,,,UNKOWN 100%/INVESTORS 0%,https://www.looklateral.com/LLWhitePaper.pdf?utm_source=coincodex&utm_medium=referral,https://t.me/looklateralofficialchat,,,,,,,,,0.00,,,,,,,,,,
LOLTOKEN ,LOLTOKEN ,(LOL) STO,"The team behind the LOL project already owns and runs international kindergartens, primary and second schools, a business school for the past 20+ years, as well as most recently, added a French Government recognized and internationally accredited university to their already fascinating portfolio. They are redefining education with integrated Digital Learning Platform on our decentralized LOL ecosystem.",https://loleiu.io/?utm_source=coincodex&utm_medium=referral,https://twitter.com/coin_lol,https://www.facebook.com/EIUParis/,,,,"Apr 15, 2019 - Dec 15, 2019",STO,,,,,UNKOWN 55%/INVESTORS 20%,https://loleiu.io/docs/LOL_WP.pdf?utm_source=coincodex&utm_medium=referral,https://t.me/joinchat/G1P6Ag0hh6lVrk0pvRx1mA,https://www.youtube.com/channel/UCbSz92F1ZQ8JprflmD1II_g,,,,,,,,825.00M,,,,,,,,,,
Tokenomica ,Tokenomica ,(TKN) STO,"Tokenomica is the all-in-one financial platform for automated issuance, offering and trading of tokenized assets. At the core of the platform lies an entirely new asset class — smart security, which combines the legal essence of traditional securities (e. g. shares and bonds) with the cutting‑edge distributed ledger technology.",https://tokenomica.com/?utm_source=coincodex&utm_medium=referral,,,,,,"Oct 28, 2019 - Dec 15, 2019",STO,,,,,UNKOWN 100%/INVESTORS 0%,,,,https://coincodex.enjinx.io/eth/token/0xaaaf91d9b90df800df4f55c205fd6989c977e73a,,,,,,,0.00,,,,,,https://blog.tokenomica.com/,,,,
Bitcademy Football ,Bitcademy Football ,(BTMG) STO,"Bitcademy are football academies helping and empowering young players to achieve their dreams. They create and use new technologies, artificial intelligence and player predictions to make sure they have the best talent. Finally, with the use of marketplace powered by the blockchain to ensure fans participate in the game and create their future stars.",https://bitcademy.io/?utm_source=coincodex&utm_medium=referral,https://twitter.com/bitcademyfb,https://www.facebook.com/bitcademyfootball/,,,https://medium.com/@bitcademyfb,"May 1, 2019 - Nov 30, 2019",STO,,,,,UNKOWN 50%/INVESTORS 15%,https://bitcademy.io/files/Bitcademy_Whitepaper.pdf?utm_source=coincodex&utm_medium=referral,https://t.me/bitcademyfb,https://www.youtube.com/channel/UCtcmIetjsquyQybiKkKOjzg,,https://bitcointalk.org/index.php?topic=4886052.0,https://github.com/bitcademyfb,https://www.reddit.com/r/bitcademyfb/,,mailto:mailto:contact@bitcademy.io,,500.00M,,,,https://discordapp.com/channels/469211726634680320/505314957789757440,https://bitcademy.slack.com/,,,,,
Isonex Capital ,Isonex Capital ,(IX15) STO,IX15 leverages the low stock-and-bond correlation of digital currencies and is designed to diversify investments from traditional asset classes that are strongly connected to overall financial fundamentals — a real hedge against inevitable market cyclicality and imminent financial unrest.,https://www.isonex.io/?utm_source=coincodex&utm_medium=referral,https://twitter.com/isonexcapital,https://www.facebook.com/isonexcapital,,,https://medium.com/isonex,"Jul 15, 2019 - Nov 29, 2019",STO,,,,,UNKOWN 93%/INVESTORS 5%,https://www.isonex.io/documents/whitepaper?utm_source=coincodex&utm_medium=referral,https://t.me/isonexchat,https://www.youtube.com/channel/UCX3NQAiRqUwAFnXxDs-NWJA,https://etherscan.io/address/0x93d2b9446d04b5cefc17bbe354c0098b00439878,,,https://www.reddit.com/r/isonex,,,,15.00M,,,,,,,,,,
Project Crowd AG ,Project Crowd AG ,(PCT) STO,"Project Crowd will address and resolve several of the fundamental issues affecting employers, recruiters and freelancers with the development of the “Prowd” platform. Issues such as trust, cultural fit, time to hire, efficiency, and costs. By combining a range of technologies including AI to simplify the search for qualified external specialists with functionality based on Blockchain technology, Prowd will deliver unprecedented potential and ground-breaking results in recruitment and employment. The Prowd platform is making it easier and more efficient for everyone involved in the freelance employment process. In short, the Prowd platform will connect companies and recruiters to the growing freelancer community in a unique, efficient and trusted new way delivering greater value to the entire industry.",https://www.prowd.io/?utm_source=coincodex&utm_medium=referral,https://twitter.com/_ProjectCrowd,https://facebook.com/projectcrowd.io,https://instagram.com/prowd_io/,https://linkedin.com/company/projectcrowd,,"Oct 15, 2019 - Nov 29, 2019",STO,,,,,UNKOWN 100%/INVESTORS 0%,https://projectcrowd.weown.com/?utm_source=coincodex&utm_medium=referral,http://t.me/projectcrowd,https://www.youtube.com/watch?v=LV70-ujAefo,,,,,,,,0.00,,,,,,,,,,
Rokkex ,Rokkex ,(RKX) STO,ROKKEX is a next generation crypto exchange with a foundation of security and performance. ROKKEX enables both the beginner and advanced trader to exchange crypto assets instantly with maximum safety.,https://www.rokkex.com/sto/?utm_source=coincodex&utm_medium=referral,https://twitter.com/Rokkex_CH,https://www.facebook.com/rokkex/,,https://www.linkedin.com/company/rokkex,https://medium.com/@rokkex,"Aug 26, 2019 - Nov 18, 2019",STO,,,,,,https://www.rokkex.com/wp-content/uploads/2019/05/RKX_WP.pdf?utm_source=coincodex&utm_medium=referral,https://t.me/RokkexOfficial,,https://etherscan.io/token/0xead6bc168c5ff906ea51ca1693cb3df63041f384,,,https://www.reddit.com/r/Rokkex,,,,20.39M,,,,,,,,,,
Ophelius Labs ,Ophelius Labs ,(OPPL) STO,Programmable Tokens + A.I. + 3D Printing,https://www.opheliuslabs.com/?utm_source=coincodex&utm_medium=referral,https://twitter.com/OpheliusLabs,https://www.facebook.com/ophelius.labs.3,,,,"Jul 15, 2019 - Oct 31, 2019",STO,,,,,UNKOWN 60%/INVESTORS 10%,,https://t.me/OpheliusLabs,,,https://bitcointalk.org/index.php?topic=5167820,,https://www.reddit.com/r/OpheliusLabs/,,,,3.04B,,,,https://discord.gg/GbyWHcv,,,,,,
Taia ,Taia ,(TAIA) STO,Taia aims to revolutionize the B2B sensitive translations that utilize Ethereum blockchain technology and Taia's own AI and Neural network by ensuring the security and quality of smart contracted translations.,https://taia.io/?utm_source=coincodex&utm_medium=referral,https://twitter.com/TAIA_io,https://www.facebook.com/TAIAmarketplace/,,https://www.linkedin.com/company/taia-translation/,https://medium.com/taiamarketplace,"Feb 28, 2019 - Oct 31, 2019",STO,,,,,UNKOWN 65%/INVESTORS 10%,,https://t.me/taiasto,https://www.youtube.com/channel/UCUpG64bi5tqm1OCSo5ui_Xw?disable_polymer=true,,,,,,,,0.00,,https://taia.io/TAIA-onepager.pdf,,,,,https://www.google.com/,,,
WANT Marketplaces ,WANT Marketplaces ,(WNT) STO,WANT Marketplaces is a shopping search engine which is among the finest on the planet.,https://benipal.com/?utm_source=coincodex&utm_medium=referral,https://twitter.com/wantmarketplace,https://facebook.com/wantmarketplaces,,https://www.linkedin.com/company/benipal-sa,https://medium.com/@wantmarketplaces,"Jun 26, 2019 - Oct 31, 2019",STO,,,,,UNKOWN 72%/INVESTORS 13%,https://benipal.com/assets/files/WANT_Marketplaces_STO_White_Paper_V1.pdf?utm_source=coincodex&utm_medium=referral,https://t.me/wantmarketplaces,,,https://bitcointalk.org/index.php?topic=5156974,https://github.com/wantmarketplaces,https://www.reddit.com/r/wantmarketplaces,,,,100.00M,,,,,https://join.slack.com/t/wantmarketplaces/shared_invite/enQtNjYxMDkyODYzMjU1LTM0YTc2NWI3NGEzNjFiNWI2ZjcyZDFiODQwNDZhYjU1MzIzYmYxMDFmZTcwYzVkM2QwYjk5ODEzM2JhOTZhZjg,,,,,
Divider ,Divider ,(DIVID) STO,Divider aims to bring the benefits of masternode & POS cryptocurrencies to the mainstream by offering an easy way to invest and do all the work for them. Divider invests in quality masternode and POS crypto projects with a high return of investment (ROI) expectation. The masternodes and staking activities are run on a server infrastructure owned by Divider. Revenue from this is shared with holders of the Divider token. Holders of the Divider token benefits from different masternode and POS projects without high investments and difficult implementation and maintenance.,https://www.dividertoken.com/?utm_source=coincodex&utm_medium=referral,https://twitter.com/DividerToken,https://www.facebook.com/DIVIDERTOKEN/,,,,"Jun 1, 2019 - Oct 1, 2019",STO,,,,,UNKOWN 80%/INVESTORS 10%,https://www.dividertoken.com/images/divider-whitepaper.pdf?utm_source=coincodex&utm_medium=referral,https://t.co/bIt94hcJPO,,,https://bitcointalk.org/index.php?topic=5119114.0,,https://www.reddit.com/user/Dividertoken,,,,48.00M,,,,https://discord.gg/SQnvqHP,,,,,,
Ledgity ,Ledgity ,(LTY) STO,"Ledgity is a platform and mobile application fully dedicated to Security Tokens, starting from their issuance to their exchange. Users get access to a technology that is 100% compliant with applicable laws and regulations governing security tokenization.",https://ledgity.com/?utm_source=coincodex&utm_medium=referral,https://twitter.com/ledgityplatform,https://www.facebook.com/ledgity/,,https://www.linkedin.com/company/ledgity/,https://medium.com/ledgity,"Jul 1, 2019 - Sep 30, 2019",STO,$ 0.11,,,,UNKOWN 63%/INVESTORS 37%,,https://t.me/ledgity,https://www.youtube.com/channel/UCoVl6zbVd8g9FKdp0kuwsag,,https://bitcointalk.org/index.php?topic=5028116.0,,https://www.reddit.com/user/ledgity,,,,370.00M,,,,,,,,,,
Stacks ,Stacks ,(STX) STO,Stacks is an open-source and developer-friendly blockchain-based network that allows users to develop decentralized applications and smart contracts on the Blockstack network. The team behind Stacks aims to offer the same security Bitcoin has while also the expressivity that is required for developing DApps. ,http://stacks.co/?utm_source=coincodex&utm_medium=referral,https://twitter.com/Stacks,https://forum.stacks.org/,,,,"Nov 13, 2017 - Sep 9, 2019",STO,$ 0.30,,,,UNKOWN 60%/INVESTORS 40%,https://gaia.blockstack.org/hub/1AxyPunHHAHiEffXWESKfbvmBpGQv138Fp/stacks.pdf?utm_source=coincodex&utm_medium=referral,https://t.me/BlockstackChat,,https://explorer.stacks.co/,,https://github.com/blockstack,,,,,180.33M,,,,,,https://blog.blockstack.org/,,,,
MinedBlock ,MinedBlock ,(MBTX) STO,"MinedBlock offers the opportunity for investors to purchase the projects ST20 Security Token which is a digital asset backed by a corresponding Preference Share in MinedBlock Holding Limited (the Special Purpose Vehicle) that enables holders to receive a revenue share produced by our mining farms. Collectively, MBTX token holders will own 95% of the Special Purpose Vehicle and the associated costs and revenue so, therefore, will receive the revenue share each month based on the profit generated. Revenue will be shared respectively and equally between all token holders on a ‘payout per token’ model.",https://dashboard.minedblock.io/?utm_source=coincodex&utm_medium=referral,,,,,,"Jan 28, 2019 - Aug 31, 2019",STO,,,,,UNKOWN 91%/INVESTORS 9%,https://www.minedblock.io/assets/MinedBlockWhitepaper.pdf?utm_source=coincodex&utm_medium=referral,,,,,,,,,,365.00M,,,,,,,,,,
INDX Capital ,INDX Capital ,(INDX) STO,"INDX is the world’s leading tokenized Masternode investment fund. INDX token owners earn regular passive income through distribution of aggregated Masternode rewards. The proprietary algorithm scans the market for available Masternodes, builds an optimal Masternode portfolio that generates a yield from the stake in the Masternodes funded through capital raised from sale of INDX tokens. The fund then distributes 50% of net yield as a quarterly dividend to token holders and the remaining 50% is reinvested back into the portfolio to grow the token NAV on exchanges.",https://indx.capital/?utm_source=coincodex&utm_medium=referral,https://twitter.com/INDX_CAPITAL,,,https://www.linkedin.com/company/indx.capital/,https://medium.com/indx-capital,"Jul 1, 2019 - Aug 30, 2019",STO,,,,,UNKOWN 83%/INVESTORS 8%,https://indx.capital/files/INDX_Group_Whitepaper.pdf?utm_source=coincodex&utm_medium=referral,,https://www.youtube.com/channel/UCMUAKlMfCepyfnfXCnA4Y7Q?disable_polymer=true,,,,,,,,50.00M,,,,,,,,,,
OZOTOP ,OZOTOP ,(OZO) STO,"OZOTOP is the decentralized expert's community and self-regulating robonomic society model supported by smart-contracts, robots, and bots based on Telegram Open Network blockchain.",https://ozotop.io/?utm_source=coincodex&utm_medium=referral,https://twitter.com/OZOTOP2,https://www.facebook.com/ozotop33,,https://www.linkedin.com/company/ozotop,https://medium.com/@ozotop,"Aug 8, 2019 - Aug 30, 2019",STO,,,,,UNKOWN 51%/INVESTORS 25%,https://ozotop.io/wp-content/uploads/2019/07/OZOTOP_White_Paper_888.pdf?utm_source=coincodex&utm_medium=referral,https://t.me/ozotop,https://www.youtube.com/channel/UC-_exNmJ7rSld59QF9J0u1g,,,https://github.com/Ozotop,https://www.reddit.com/user/OZO_TOP,,,,,,,,,,,,,,
Algotrading ,Algotrading ,(ALGO) STO,Algotrading is Institutional-Grade Automated Trading Software and Executing Multi-Asset Trading Strategies.,https://algotrading.ltd/?utm_source=coincodex&utm_medium=referral,https://twitter.com/algotrading_ltd,https://www.facebook.com/algotrading.ltd/,,https://www.linkedin.com/in/vakovalev1/,,"Jul 1, 2019 - Aug 16, 2019",STO,,,,,UNKOWN 70%/INVESTORS 10%,https://algotrading.ltd/Algotrading_Whitepaper.pdf?utm_source=coincodex&utm_medium=referral,,,https://etherscan.io/token/0x57c1a7b7e576ad092791689b2ca5311cc5428ff2,https://bitcointalk.org/index.php?topic=5158756,,,,,,"700,000",,,,,,,,,,
Stellerro ,Stellerro ,(STRO) STO,"As the bridge between traditional capital markets and the innovative world of digital securities backed by Blockchain technologies, Stellerro™ has aligned with top global financial institutions and investment funds as a dedicated partner to enhance the integration of both ecosystems.",https://www.stellerro.com/?utm_source=coincodex&utm_medium=referral,https://twitter.com/stellerro,https://www.facebook.com/Stellerro/,,https://www.linkedin.com/company/stellerro-ltd/,https://medium.com/stellerro,"Jun 2, 2019 - Aug 16, 2019",STO,,,,,UNKOWN 85%/INVESTORS 15%,,,,,,,,,mailto:mailto:Info@Stellerro.com,,6.80M,,,,,,,,,,
Bitbond Token ,Bitbond Token ,(BB1) STO,The Bitbond Token is Germany's first security token that aims to make business lending globally accessible with their new blockchain based global lending platform.,https://www.bitbondsto.com/?utm_source=coincodex&utm_medium=referral,https://twitter.com/bitbond,https://www.facebook.com/Bitbond/,,,,"Mar 11, 2019 - Aug 7, 2019",STO,,,,,UNKOWN 100%/INVESTORS 0%,https://www.bitbondsto.com/files/bitbond-sto-prospectus.pdf?utm_source=coincodex&utm_medium=referral,https://t.me/BitbondSTOen,https://www.youtube.com/user/Bitbond,,,,,,mailto:mailto:invest@bitbondsto.com,,0.00,https://www.bitbondsto.com/files/bitbond-sto-lightpaper.pdf,,,,,,,,,
Blueshare ,Blueshare ,(BST) STO,"Blueshare is a blockchain based project that offers BST security tokens, that represent tokenized equity capital participation shares of Interprom Mining AG, a Swiss-based consolidated company.",https://www.blueshare.io/?utm_source=coincodex&utm_medium=referral,https://twitter.com/BlueshareToken,https://www.facebook.com/Blueshare.io/,,https://www.linkedin.com/company/blueshare/,https://medium.com/blueshare,"May 6, 2019 - Aug 3, 2019",STO,,,,,UNKOWN 100%/INVESTORS 0%,https://www.blueshare.io/white-paper?utm_source=coincodex&utm_medium=referral,,https://www.youtube.com/channel/UCo67mUHL6-iDqj1jmzFa7ag,,,,,,,,80.00M,,,,,,,,,,
BlockState ,BlockState ,(BKN) STO,BlockState is a Swiss security token platform for non-bankable assets such as SME equity and debt or real estate. We digitise assets to directly connect issuers and investors. ,https://blockstate.com/?utm_source=coincodex&utm_medium=referral,https://twitter.com/blockstate_com,https://www.facebook.com/blockstatefinance/,,https://www.linkedin.com/company/blockstate/,https://medium.com/blockstate-finance,"Jun 18, 2019 - Jul 12, 2019",STO,,,,,UNKOWN 91%/INVESTORS 9%,http://blockstate.com/blockstate_companydeck/?utm_source=coincodex&utm_medium=referral,https://t.me/BlockState,,,,,https://www.reddit.com/r/blockstate,,,,"10,000",,,,,,,,,,
FilmBusinessBuster ,FilmBusinessBuster ,(FBB) STO,"The Film Business Buster™ Smart Contract will enable all New Film Token holders to a) access The Screenplay,Letters of Intent and Financial Records, b) exercise voting rights on five critical financing gates which enable the successive filmmaking process and/or film business cycle stages and c) receive in perpetuity the net profits from all the New Film´s multiple revenue sources. The Film Business Buster™ will also enable highly talented but industry-excluded screenwriters to d) submit Screenplays for Estudios Amazonia to review, select,executive-produce and co-produce according to predefined criteria, including story quality, film budget and their target market-audience opportunity, among other elements later to be published.",http://filmbusinessbuster.com/?utm_source=coincodex&utm_medium=referral,https://twitter.com/FBB_Token,https://www.facebook.com/FilmBusinessBuster/,,,https://medium.com/@flickmaking,"Apr 15, 2019 - Jun 30, 2019",STO,,,,,UNKOWN 51%/INVESTORS 49%,https://estudios-amazonia.com/FilmBusinessBuster_WP.pdf?utm_source=coincodex&utm_medium=referral,https://t.me/FilmBusinessBuster,,,https://bitcointalk.org/index.php?topic=5120755,https://github.com/estudios-amazonia/FilmBusinessBuster,https://www.reddit.com/u/FBB_Token/,,,,"490,000",,,,,,,,,,
TokenData ,TokenData ,(TDA) STO,TokenData is an asset back token and the TDA token is the first European security token powered by Ethereum to offer its holders a unique quarterly share profit distribution.,https://tokendata.ai/?utm_source=coincodex&utm_medium=referral,https://twitter.com/tokendataai/,https://www.facebook.com/TokenData-1884067325220498/,,https://www.linkedin.com/company/tokendata-ai/,https://medium.com/@tokendataICO/,"Dec 1, 2018 - Jun 30, 2019",STO,,,,,UNKOWN 100%/INVESTORS 0%,,https://t.me/tokendataofficial,,,,,https://www.reddit.com/user/tokendataico/,,mailto:mailto:hello@tokendata.ai,,0.00,,,,https://discordapp.com/channels/484700860094349312/,,,,,,
TapJets ,TapJets ,(TJA) STO,TapJets is a real-time private jet booking platform that connects clients with a private jet that's ready to take you to your destination.,https://www.tapjets.io/?utm_source=coincodex&utm_medium=referral,https://twitter.com/tapjets,https://www.facebook.com/TapJets/,https://www.instagram.com/tapjets/,https://www.linkedin.com/company/10475529/,https://medium.com/@eugenekesselman,"Mar 15, 2019 - Jun 15, 2019",STO,,,,,UNKOWN 70%/INVESTORS 30%,https://tfmedia.azureedge.net/media/docs/Pitch_Deck_Public_Final.pdf?utm_source=coincodex&utm_medium=referral,https://telegram.me/TeamTapjets,https://www.youtube.com/channel/UCoa5U5SNQMzodb0mHSeCsuA,,https://bitcointalk.org/index.php?topic=5119445.msg50119737#msg50119737,https://github.com/search?q=TapJets,https://www.reddit.com/user/TapJetsFounders,,,,6.00M,,,,,,,,,,
HYGH ,HYGH ,(HYGH) STO,"HYGH is a game-changing peer-to-peer advertising network and content management system, which is set to revolutionize the $600bn advertising industry by allowing brands of any size to connect with the consumer of tomorrow, today.",https://hygh.tech/?utm_source=coincodex&utm_medium=referral,https://twitter.com/hyghag,https://www.facebook.com/hyghag/,https://www.instagram.com/hygh_official/,,https://medium.com/hygh-tech,"Jan 7, 2019 - Jun 7, 2019",STO,,,,,UNKOWN 60%/INVESTORS 20%,https://hygh.tech/docs/HYGH-Paper.pdf?utm_source=coincodex&utm_medium=referral,https://t.me/hyghag,https://www.youtube.com/channel/UCMeZRN85xZQmvcbMEQyEunA,,,,https://reddit.com/r/HYGH/,,,,600.00M,,,,,,,,,,
Thaler One ,Thaler One ,(TLR) STO,"Thaler.One combines a Fund regulated under the laws of the European Union with a Marketplace for listing of individual real estate assets, all SEC compliant.Thaler.One digital securities provide investors with a stable income that results both from real estate rental and from operating income of online platform, that allows building individualized real estate portfolios.",https://thaler.one/?utm_source=coincodex&utm_medium=referral,https://www.twitter.com/thalerone,https://www.facebook.com/thalerone/,,,https://medium.com/thaler-one,"Mar 10, 2019 - May 31, 2019",STO,,,,,UNKOWN 88%/INVESTORS 12%,https://thaler.one/files/white_paper.pdf?utm_source=coincodex&utm_medium=referral,https://t.me/thaleroneproject,,,,,,,,,88.00M,,,,,,,,,,
Cryptobirds ,Cryptobirds ,(XCB) STO,Crypto Birds Platform is the first STO regulated in Spain.,https://www.cryptobirds.com/?utm_source=coincodex&utm_medium=referral,https://twitter.com/CryptoBirds,https://www.facebook.com/cryptobirds,,,https://medium.com/@cryptobirdsplatform,"Apr 23, 2019 - May 28, 2019",STO,,,,,UNKOWN 45%/INVESTORS 36%,https://www.cryptobirds.com/images/crypto-birds-platform-whitepaper-en.pdf?utm_source=coincodex&utm_medium=referral,https://t.me/CryptoBirdsGroup,https://www.youtube.com/channel/UCdm_1Ki_pbx6dchKkMrhDZA,,,,,,,,200.00M,,,,,,,,https://steemit.com/@cryptobirds,,
Gainfy ,Gainfy ,(GAIN) STO,"Gainfy is a tech company that wants to change the healthcare industry with the aid of blockchain, AI and IoT.",https://gainfy.com/token-gainfy/?utm_source=coincodex&utm_medium=referral,http://www.twitter.com/gainfy,http://www.facebook.com/gainfy,,https://www.linkedin.com/company-beta/11247412,https://medium.com/@Gainfy,"Sep 24, 2018 - May 16, 2019",STO,,,,,UNKOWN 40%/INVESTORS 30%,https://gainfy.com/wp-content/uploads/2018/08/Gainfy_WhitePaper_V.9.1-min.pdf?utm_source=coincodex&utm_medium=referral,https://t.me/gainfy_chat,,,,https://github.com/gainfy,,,mailto:mailto:team@gainfy.com,,200.00M,,,,,,,,,https://plus.google.com/101329400646285796969?hl=en,
Blockport Security ,Blockport Security ,(BPS) STO,"Blockport is the first social cryptocurrency exchange. In order to achieve mass-adoption of cryptocurrency, it has to easy-to-use for everyone. Therefore, Blockport builds a user-friendly platform that is connected to external exchanges to aggregate liquidity and offer this directly to their users for the best prices. Moreover, Blockport will be built on a hybrid-decentralized architecture that allows the user to store their funds on the blockchain and manage their private keys all from the Blockport platform, whilst also having access to a high-performance and easy-to-use trading facility. The unique social copy-trading features of Blockport allow beginners to follow and/or copy experienced traders on the platform, and experienced traders are incentivized to share their trading activities with beginners because they earn Blockport's native token BPT as a reward!",https://blockport.io/sto?utm_source=coincodex&utm_medium=referral,https://twitter.com/blockportio,https://www.facebook.com/blockport,,,,"Mar 31, 2019 - May 15, 2019",STO,,,,,UNKOWN 80%/INVESTORS 20%,https://files.blockport.io/file/BlockportWhitepaperV2.pdf?utm_source=coincodex&utm_medium=referral,https://t.me/blockport,,,,,https://www.reddit.com/r/Blockport/,,mailto:mailto:support@blockport.io,,0.00,,,,,,,,,,https://vimeo.com/user94430288
everiToken ,everiToken ,(EVT) STO,"The everiToken is a blockchain based project that is developed for real business with lightning-fast crypto payments, and secure and simple contracts.",https://www.everitoken.io/?utm_source=coincodex&utm_medium=referral,https://twitter.com/EveriToken,https://www.facebook.com/everiToken,,,https://medium.com/@everitoken,"May 10, 2019 - May 12, 2019",STO,$ 0.10,,,,UNKOWN 55%/INVESTORS 45%,https://everitoken.io/docs/whitepaper.pdf?utm_source=coincodex&utm_medium=referral,https://t.me/everitoken,,https://explorer.binance.org/asset/EVT-49B,https://bitcointalk.org/index.php?topic=5135610,https://github.com/everitoken,https://www.reddit.com/r/everitoken/,,,,1.00B,,,,,,,,,,
