,ICO Name,ICO Category Name,ICO Description,ICO Important,Money Goal,Goal,Website,Facebook link,Twitter link,T.Me link,Youtube link,Medium link,Token Sale,Ticker,Token type,ICO Token Price,Fundraising Goal,Total Tokens,Available for Token Sale,Whitelist,Min/Max Personal Cap,Accepts,Role of Token,Addional Link{id},Whitepaper,Reddit link,Discord link,Сan't participate
Coinspaid,Coinspaid,(Blockchain Service),CoinsPaid is an organisation providing cryptocurrency payment services and personal wallets.,"Coinspaid will hold a Strong Holder Offering on the 24. Aug. The SHO will happen on DAO Maker. (Whitelist).
Coinspaid will hold a Initial Dex Offering on the 31. Aug. The IDO will happen on SpacePort. (Details).","$1,800,000","OF
$2,120,000 (85%)",https://coinspaid.com/?utm_source=icodrops,https://www.facebook.com/coinspaid/,https://twitter.com/coinspaid,https://t.me/CoinsPaid_Official,https://www.youtube.com/channel/UCwnF8wI6tIl3h8KNgpwhqAg,https://coinspaid.medium.com/,TOKEN SALE: 24 AUG – 1 SEP,CPD,ERC20,1 CPD = 0.02 USD,"14,500,000 TOKEN","800,000,000",21%,"YES (PERIOD ISN'T SET, JOIN )",TBA / $500,USDT,UTILITY,IDO Info # https://apy.plasma.finance/#/market/0x9b31bb425D8263fA1b8B9d090b83CF0C31665355/ido,,,,
Skyrim Finance,Skyrim Finance,(Protocol),Skyrim Finance is a Multichain Protocol focusing on Fixed-rate and Leveraged-yield DeFi Products.,"Skyrim Finance will hold a Genesis Round on the 23. Aug.
Skyrim Finance will hold a Initial Dex Offering on the 31. Aug.
Skyrim Finance will hold a IEO on the 1. Sept. (Details).","$2,100,000",RECEIVED,https://skyrim.finance/?utm_source=icodrops,,https://twitter.com/SkyrimFinance,https://t.me/skyrimfinance,,https://medium.com/@skyrimfinance,TOKEN SALE: 23 AUG – 1 SEP,SKYRIM,ERC20,,TOKEN,"100,000,000",33%,,,,UTILITY,IDO Info # https://skyrimfinance.medium.com/skyrim-finance-skyrim-token-launch-db39ba4bdd84,https://docs.skyrim.finance/,,,
Star Atlas,Star Atlas,(Gaming),Star Atlas is a virtual gaming metaverse.,"The total supply of the ATLAS token is 36,000,000,000
The total supply of the POLIS token is 360,000,000
Star Atlas will hold a Public Sale on the 29. Aug. (Details).","$500,000","OF
$1,000,000 (50%)",https://staratlas.com/?utm_source=icodrops,https://www.facebook.com/StarAtlasMMO,https://twitter.com/staratlas,https://t.me/staratlasgame,https://www.youtube.com/channel/UCt-y8Npwje5KDG5MSZ0a9Jw/videos,https://medium.com/star-atlas,OUR RATING,"ATLAS, POLIS",SOLANA,"1 ATLAS, POLIS = 0.00138 USD","363,600,000 TOKEN",,2%,,$400 / $500,,UTILITY,IDO on FTX # https://ftx.com/atlas-polis-ieo,https://staratlas.com/files/star-atlas-white-paper.pdf?pdf=White-Paper,https://www.reddit.com/r/staratlas,https://discord.gg/staratlas,US NON-ACCREDITED INVESTORS
Acala Network,Acala Network,(Governance Token),"ACA is the native token of ACALA Network. The total supply of the ACA Tokens will be minted at the launch of the mainnet and stored in the ACA Reserve Pool to be distributed to ACALA Foundation, Seed Investment Partners, IPO Participants as Reward, and the rest sold to the public.","Acala Network will hold a Event ""Build Acala: Ready the Treasury"". (Details).
There are 2 rounds: Round 1 ""Old Friends"" on the 30. Aug. and Round 2 ""Open Community"" on the 2. Sept.","$31,500,000",RECEIVED,https://acala.network/?utm_source=icodrops,,https://twitter.com/AcalaNetwork,https://t.me/acalaofficial,https://www.linkedin.com/company/acalanetwork,https://medium.com/acalanetwork,OUR RATING,ACA,OWN BLOCKCHAIN,,TOKEN,"1,000,000,000",,"YES (SINCE 15 AUG, JOIN )",,"ETH, USDC, DOT",UTILITY,Sale Info # https://info.acala.network/event-details,https://github.com/AcalaNetwork/Acala-white-paper,,https://discord.gg/6QHVY4X,"CHINA, CRIMEA REGION, CUBA, IRAN, NEW ZEALAND, NORTH KOREA, SYRIA, UKRAINE, US NON-ACCREDITED INVESTORS"
Mobox,Mobox,(Platform),Mobox is a community-driven GameFi platform empowering users by rewarding them for their engagement and enjoyment.,Mobox will hold a launchpool on the 20. Aug. The launchpool will happen on Binance. (Details).,NOT SET,GOAL,https://www.mobox.io/#/?utm_source=icodrops,,https://twitter.com/MOBOX_Official,https://t.me/mobox_io,https://github.com/moboxio/,https://mbox.medium.com/,TOKEN SALE: 20 AUG – 18 SEP,MBOX,BEP-20,,"3,000,000 TOKEN","1,000,000,000",,,,"BNB, BUSD",UTILITY,Sale Info # https://www.binance.com/en/support/announcement/3e99653fbe67405fb69e1b6d5b93bb06,https://faqen.mobox.io/,,https://discord.gg/gW2eAU4WZy,
AirNFTs,AirNFTs,(Marketplace),AirNFTs is a NFT Marketplace on Binance Smart Chain.,"Create your NFT and earn BNB and AIRT for all your NFTs that you sell.
NFT/Token Sale on Launchpad","$10,000,000",GOAL,https://www.airnfts.com/?utm_source=icodrops,,https://twitter.com/airnfts,https://t.me/airnfts,https://www.airnfts.com/blog,,TOKEN SALE: SINCE 12 AUG,AIRT,BEP-20,1 AIRT = 0.05 USD,BNB,"1,000,000,000",20%,,,BNB,UTILITY,,,,https://discord.gg/TXjQUVWXx7,
