,ICO Name,ICO Active,ICO Comment Views,ICO Description,Total Score,ICO Profile,Social Activity,Team Proof,Website,White paper,ICO Time,Ticker,Platform,Token Type,Available for sale,Total supply,Pre-sale Price ,Accepting,Hard cap,Bonuses,Facebook link,Twitter link,Telegram link,Reddit link,Medium link,Youtube link,MVP,Pre-sale Time,Country,ICO Price,Soft cap
SIF TOKEN,SIF TOKEN,ICO has 40 days left ,"3,935 Views","SIF TOKEN is a SIFIRINCIFILO initiative that takes its power from binance smart chain. The purpose of existence is to provide funds for the project and initiative ecosystem created. For this reason, SIF Token will provide funding support to SIFIRINCIFILO initiatives, not just to be traded in the markets. This shows that there is always an infinite transformation for SIF TOKEN. When you, our esteemed stakeholders, have SIF TOKEN, you will also support many project owners and entrepreneurs. In addition, we plan to offer many ways to obtain SIF TOKEN for you and continue our work on it. You will be able to earn SIF TOKEN with our games in development and various competitions. Our aim is to always make SIF TOKEN valuable in an endless cycle and to provide future profits to our investors. With the ecosystem we have created, you can buy, exchange, earn and sell SIF TOKEN.",6.2,6.9(weight: 45%),3(weight: 35%),10(weight: 20%),https://www.siftoken.org/?utm_source=icomarks,https://www.siftoken.org/whitepaper.html,16 May 2021 - 11 Oct 2021,SIF,Binance Chain,BEP-20,"2,100,000,000 SIF (65%)","10,000,000,000 SIF",1 SIF = 0.022 USD,"BTC, ETH, BNB, USDT, USDC, TRX",1 000 000 USD,Presale: 2% (For Round 5) Reference bonus: % 20,https://www.facebook.com/siftoken,https://twitter.com/siftoken,https://t.me/joinchat/ePp2tEwlTiE4ZWZk,https://www.reddit.com/user/siftoken,https://medium.com/@siftoken,https://www.youtube.com/channel/UCzun7PC_jZ6gDk1g9akmjLg,,,,,
VectraCoin,VectraCoin,ICO will end today ,"3,547 Views","Vectra has Bitcoin’s recognition, Ethereum’s smart contracts, and Monero’s one-time ring signature and anonymity.
Besides, VECTRACOIN has the lowest transaction fees and speed of up to 1000 operations per second thanks to the innovative VectraNetwork.
SUPPORT FOR SMART CONTRACTS: In-house programming language for smart contracts.
LOW TRANSACTION FEES: The lowest transaction fees among all currencies.
DECENTRALIZED SYSTEM: VectraCoin is not regulated by any single center, allowing users to make direct remittances without state or other control.
SIMPLICITY: For any transactions, an ordinary smartphone with installed VectraWallet is enough. The procedure will be comparable in simplicity to chatting via messengers.
SAFETY: Thanks to the integration of the CryptoNote algorithm, it is impossible to link the sender and the recipient with any specific person. The network and its transactions are completely anonymous thanks to single-use ring signature.
SPEED: The Bitcoin network processes 7 operations per second, while Ethereum processes 15 operations per second. The speed of the revolutionary VectraNetwork is comparable to Libra and is up to 1000 operations per second.",5.4,6.9(weight: 45%),6(weight: 35%),1(weight: 20%),https://vectracoin.io/?utm_source=icomarks,https://vectracoin.io/dev,01 Apr 2021 - 01 Sept 2021,VCT,Ethereum,ERC-20,"10,000 VCT (50%)","20,000 VCT",100,"ETH, BTC, Bitcoin SV, XRP, BNB, BCH, USDT","1,000,000 USD",,,https://twitter.com/vectracoin,https://t.me/vectratechnology,,,https://www.youtube.com/channel/UCTx3L-czyQqdlMGLw4bipZQ,https://vectracoin.io/,14 Oct 2020 - 31 Dec 2020,UK,1 VCT = 100 USD,"500,000 USD"
iZOBi,iZOBi,ICO has 426 days left ,"3,102 Views","iZOBi App works like Uber App where the customers will be able to search and get connected to a service provider. iZOBi has very great features that make our platform easy and useful for making our daily activities possible.
ZOBi App will be working on two phases which are Customers App and Service Providers App. iZOBi app has fixed two hourly rates which are very uncommon on other platforms. Customers will need to choose from two prices EUR 15 – 20 for a 1-hour service and allow service providers to accept the work. To book a handyman, it will just take less than 1 minute.",8.6,6.9(weight: 45%),10(weight: 35%),10(weight: 20%),https://izobi.io/?utm_source=icomarks,https://izobi.io/assets/Whitepaper%20iZOBi.pdf,01 Sept 2021 - 01 Nov 2022,iZOBi,Binance Chain,BEP-20,"2,400,000,000 iZOBi (48%)","5,000,000,000 iZOBi",1 iZOBi = 0.05 EUR,"BNB, ETH, BTC, EUR",,"PRE-ICO 1: 15%
PRE-ICO 2: 10%
PRE-ICO 3: 5%",https://www.facebook.com/iZOBiICO,https://twitter.com/IcoIzobi,https://t.me/izobigroup,,,https://www.youtube.com/channel/UC-olvmOl0CMV5URGsNa_Xgg,,01 May 2021 - 01 Aug 2021,Lithuania,1 iZOBi = 1 EUR,
